image_id,page,local_file,subject,source_platform,source_title,creator,license,changes,rights_status
qiaopi_01,index.html,assets/images/qiaopi-chaoan-mother.webp,Qiaopi addressed to a mother in Chao'an,Wikimedia Commons,File:侨批1.jpg,三猎,CC BY-SA 4.0,"resized; WebP conversion; CSS display crop",approved_open_license
qiaopi_02,index.html,assets/images/qiaopi-singapore-wife.webp,Qiaopi connected with Singapore and addressed to a wife in Chao'an,Wikimedia Commons,File:侨批2.jpg,三猎,CC BY-SA 4.0,"resized; WebP conversion; CSS display crop",approved_open_license
house_01,index.html,assets/images/quanzhou-home-courtyard.webp,Home of Li Zhi courtyard in Quanzhou,Wikimedia Commons,File:Quanzhou Li Zhi Guju 20120229-2.jpg,Zhangzhugang,CC BY-SA 4.0,"resized; WebP conversion; CSS display crop",approved_open_license
house_02,index.html,assets/images/quanzhou-home-interior.webp,Home of Li Zhi interior in Quanzhou,Wikimedia Commons,File:Quanzhou Li Zhi Guju 20120229-4.jpg,Zhangzhugang,CC BY-SA 4.0,"resized; WebP conversion; CSS display crop",approved_open_license
hero_01,index.html,assets/images/minnan-house-hero.svg,Original Minnan ancestral-house illustration,minnan.org,Original artwork,minnan.org,All rights reserved,none,original
